,id,名称,描述,icon,拥有者id,前置技能,解锁等级,需要读条,前摇时长,后摇时长,技能进入冷却的时机,冷却时长,是被动技能,技能堆叠上限,堆叠一层用时
,int,string,string,string,int,int[],int,bool,float,float,enum:start|cast|end,float,bool,int,float
,201,普攻：飞刀,"发出飞刀攻击敌人,造成100%攻击的伤害",,2,,0,False,0,0,0,0.5,False,1,0
,211,假想时轴,咲夜的每次伤害会额外造成一次等同于原本伤害的60%的伤害,,2,,1,False,0,0,0,1.2,False,1,0
,212,主观缓时,咲夜自身攻速提升50%，攻击提升20%,,2,,1,False,"0 ",0,0,0.7,False,1,0
,221,伤符「Inscribe Red Soul」,双手执匕首对敌人实施连续斩击。攻击范围缩小至原先的50%，连续打出12次斩击，每次斩击造成70%的伤害,,2,,3,True,0.15,0.2,1,35,False,1,0
,231,伤魂「Soul Sculpture」,伤符的强化版，攻击范围缩小为原来的80%，15次斩击每次造成100%的伤害,,2,221,7,True,0.15,0.2,1,27,True,1,0
,222,时符「咲夜特制秒表」,投射出时间停止区域，创造出0.7格半径的圆形区域，该区域半径会线性减少，3s后完全消失。,,2,,3,True,0.7,0.15,1,55,False,1,0
,232,时计「Luna Dial」,范围与持续时间扩大范围扩大至1.2格，4.5s后消失,,2,222,7,True,0.7,0.10,1,45,True,1,0